{
  "$schema": "https://json-schema.org/draft/2020-12/schema",
  "$id": "https://couple-app.invalid/contracts/generated-object-v1.schema.json",
  "title": "Generated Object v1 (aroomi-shape-v1)",
  "description": "Serializable DATA describing one small new 2D vector decoration generated by the model: a room background piece, a speech-bubble frame or a small room prop, as a flat list of restricted shapes. It is never SVG text, markup or code: the server validates and normalizes it, the client only renders validated data. This schema covers the STRUCTURAL part only (keys, types, enums, counts, patterns, coarse numeric ranges). The following checks are validator-enforced (design/tools/aroomi-shape/validate.mjs) because JSON Schema cannot express them: palette allowlist (app palette tokens + room day wall/floor); duplicate palette colors; coordinates and shape bounds within [-8, viewBox+8] and at most 2 decimals; the longer viewBox side being 128..512 (prop: 64..256); props: at most 30 shapes (schema) and complexityScore <= 45, and the PROP_FACE_LIKE heuristic (eyes-and-mouth look-alike guard: two or more small dark ellipses side by side inside a larger body shape plus a short curved path below them; crude, not a guarantee); path grammar (absolute M L H V C Q Z only, argument counts, at most 48 commands, plain decimals) and path bounding box; poly area; shape fill index against the palette length; fill null together with stroke false; label URL/phone-like rejection; complexityScore (shapes + pathCommands/4 + polyPoints/6) <= 60 (prop: 45); whole document <= 12 KB; and for bubble_frame: textArea inside the viewBox and at least 40% x 25% of it, text-to-fill contrast >= 4.5 against #3A261C, a rect/ellipse/poly cover shape with fill == textFill that contains the textArea, no later shape drawn over the textArea, and tail within the bleed. The renderer draws the outline (#4A3426) and the cream rim (#FFF4DF) itself; neither is part of the document. There are no opacity, gradient, filter, transform, clip, mask, text, image, reference or animation features by design.",
  "type": "object",
  "additionalProperties": false,
  "required": ["schemaVersion", "format", "kind", "label", "viewBox", "anchor", "palette", "shapes"],
  "properties": {
    "schemaVersion": { "const": 1 },
    "format": { "const": "aroomi-shape-v1" },
    "kind": { "enum": ["background_piece", "bubble_frame", "prop"] },
    "layerHint": { "enum": ["wall", "floor", "backdrop", "window_view", "shelf"], "description": "Placement hint. background_piece: wall | floor | backdrop | window_view. prop: floor | wall | shelf. bubble_frame: none." },
    "label": {
      "type": "string",
      "minLength": 1,
      "maxLength": 24,
      "pattern": "^(?! )[A-Za-z0-9 .,'\\-\\u3131-\\u318E\\uAC00-\\uD7A3\\u3041-\\u3096\\u30A1-\\u30FA\\u30FC]+(?<! )$",
      "description": "Short human label: Hangul, Latin, Kana, digits, space and . , ' - only. URL-like text, phone-like digit runs and control characters are additionally rejected by the validator."
    },
    "viewBox": {
      "type": "object",
      "additionalProperties": false,
      "required": ["w", "h"],
      "description": "Origin is always 0,0. The longer side must be 128..512 (validator-enforced).",
      "properties": {
        "w": { "type": "integer", "minimum": 32, "maximum": 512 },
        "h": { "type": "integer", "minimum": 32, "maximum": 512 }
      }
    },
    "anchor": {
      "type": "object",
      "additionalProperties": false,
      "required": ["x", "y"],
      "description": "Pivot (0..1 of the viewBox) the app uses when it places the object.",
      "properties": {
        "x": { "type": "number", "minimum": 0, "maximum": 1 },
        "y": { "type": "number", "minimum": 0, "maximum": 1 }
      }
    },
    "palette": {
      "type": "array",
      "minItems": 1,
      "maxItems": 4,
      "uniqueItems": true,
      "description": "FILL colors only (uppercase #RRGGBB). Each must be on the app palette allowlist (validator-enforced).",
      "items": { "type": "string", "pattern": "^#[0-9A-F]{6}$" }
    },
    "shapes": {
      "type": "array",
      "minItems": 1,
      "maxItems": 40,
      "description": "Drawn in order (later shapes on top).",
      "items": { "$ref": "#/$defs/shape" }
    },
    "textArea": { "$ref": "#/$defs/textArea" },
    "textFill": { "type": "integer", "minimum": 0, "maximum": 3, "description": "Palette index of the fill that sits behind the text (bubble_frame only)." },
    "tail": { "$ref": "#/$defs/point" }
  },
  "allOf": [
    {
      "if": { "properties": { "kind": { "const": "background_piece" } }, "required": ["kind"] },
      "then": {
        "required": ["layerHint"],
        "properties": { "layerHint": { "enum": ["wall", "floor", "backdrop", "window_view"] }, "textArea": false, "textFill": false, "tail": false }
      }
    },
    {
      "if": { "properties": { "kind": { "const": "prop" } }, "required": ["kind"] },
      "then": {
        "required": ["layerHint"],
        "properties": {
          "layerHint": { "enum": ["floor", "wall", "shelf"] },
          "textArea": false,
          "textFill": false,
          "tail": false,
          "viewBox": { "type": "object", "properties": { "w": { "type": "integer", "maximum": 256 }, "h": { "type": "integer", "maximum": 256 } } },
          "shapes": { "type": "array", "maxItems": 30 }
        }
      }
    },
    {
      "if": { "properties": { "kind": { "const": "bubble_frame" } }, "required": ["kind"] },
      "then": {
        "required": ["textArea", "textFill"],
        "properties": { "textArea": true, "textFill": true, "layerHint": false }
      }
    }
  ],
  "$defs": {
    "coordinate": { "type": "number", "minimum": -8, "maximum": 520, "description": "Range is checked against the actual viewBox by the validator (-8 .. size+8, at most 2 decimals)." },
    "size": { "type": "number", "exclusiveMinimum": 0, "maximum": 528 },
    "fillIndex": { "type": ["integer", "null"], "minimum": 0, "maximum": 3, "description": "Palette index, or null for no fill. The index is checked against the palette length by the validator." },
    "point": {
      "type": "object",
      "additionalProperties": false,
      "required": ["x", "y"],
      "properties": {
        "x": { "$ref": "#/$defs/coordinate" },
        "y": { "$ref": "#/$defs/coordinate" }
      }
    },
    "textArea": {
      "type": "object",
      "additionalProperties": false,
      "required": ["x", "y", "w", "h"],
      "description": "Rectangle reserved for text. Must lie inside the viewBox and be at least 40% x 25% of it (validator-enforced).",
      "properties": {
        "x": { "type": "number", "minimum": 0, "maximum": 512 },
        "y": { "type": "number", "minimum": 0, "maximum": 512 },
        "w": { "type": "number", "exclusiveMinimum": 0, "maximum": 512 },
        "h": { "type": "number", "exclusiveMinimum": 0, "maximum": 512 }
      }
    },
    "shape": {
      "oneOf": [
        { "$ref": "#/$defs/rect" },
        { "$ref": "#/$defs/ellipse" },
        { "$ref": "#/$defs/poly" },
        { "$ref": "#/$defs/path" }
      ]
    },
    "rect": {
      "type": "object",
      "additionalProperties": false,
      "required": ["t", "fill", "stroke", "x", "y", "w", "h"],
      "properties": {
        "t": { "const": "rect" },
        "fill": { "$ref": "#/$defs/fillIndex" },
        "stroke": { "type": "boolean", "description": "true draws the outline (and the cream rim under it)." },
        "x": { "$ref": "#/$defs/coordinate" },
        "y": { "$ref": "#/$defs/coordinate" },
        "w": { "$ref": "#/$defs/size" },
        "h": { "$ref": "#/$defs/size" },
        "rx": { "type": "number", "minimum": 0, "maximum": 256, "description": "Corner radius (used for both axes); at most min(w,h)/2 (validator-enforced)." }
      }
    },
    "ellipse": {
      "type": "object",
      "additionalProperties": false,
      "required": ["t", "fill", "stroke", "cx", "cy", "rx", "ry"],
      "properties": {
        "t": { "const": "ellipse" },
        "fill": { "$ref": "#/$defs/fillIndex" },
        "stroke": { "type": "boolean" },
        "cx": { "$ref": "#/$defs/coordinate" },
        "cy": { "$ref": "#/$defs/coordinate" },
        "rx": { "$ref": "#/$defs/size" },
        "ry": { "$ref": "#/$defs/size" }
      }
    },
    "poly": {
      "type": "object",
      "additionalProperties": false,
      "required": ["t", "fill", "stroke", "pts"],
      "description": "Closed polygon (the last point connects to the first).",
      "properties": {
        "t": { "const": "poly" },
        "fill": { "$ref": "#/$defs/fillIndex" },
        "stroke": { "type": "boolean" },
        "pts": {
          "type": "array",
          "minItems": 3,
          "maxItems": 24,
          "items": {
            "type": "array",
            "minItems": 2,
            "maxItems": 2,
            "prefixItems": [{ "$ref": "#/$defs/coordinate" }, { "$ref": "#/$defs/coordinate" }],
            "items": false
          }
        }
      }
    },
    "path": {
      "type": "object",
      "additionalProperties": false,
      "required": ["t", "fill", "stroke", "d"],
      "description": "Fill implicitly closes every subpath; the outline is open unless the path contains Z. Grammar and the 48-command limit are validator-enforced.",
      "properties": {
        "t": { "const": "path" },
        "fill": { "$ref": "#/$defs/fillIndex" },
        "stroke": { "type": "boolean" },
        "d": {
          "type": "string",
          "minLength": 2,
          "maxLength": 600,
          "pattern": "^M[MLHVCQZ0-9 .,\\-]*$",
          "description": "Absolute uppercase M L H V C Q Z only; plain decimals with at most 2 decimals; no exponent, no NaN/Infinity."
        }
      }
    }
  }
}
