{
  "schemaVersion": 1,
  "format": "aroomi-shape-v1",
  "kind": "bubble_frame",
  "label": "DONT spiky burst",
  "viewBox": {"w": 128, "h": 96},
  "anchor": {"x": 0.5, "y": 0.9},
  "palette": ["#F7D98B", "#D98B63"],
  "shapes": [
    {"t": "poly", "fill": 0, "stroke": true, "pts": [[64,6], [75,19], [92,12], [94,27], [112,28], [105,42], [120,50], [105,58], [112,72], [94,73], [92,88], [75,81], [64,94], [53,81], [36,88], [34,73], [16,72], [23,58], [8,50], [23,42], [16,28], [34,27], [36,12], [53,19]]}
  ],
  "textArea": {"x": 38, "y": 37, "w": 52, "h": 26},
  "textFill": 0
}
