{
  "schemaVersion": 1,
  "format": "aroomi-shape-v1",
  "kind": "prop",
  "layerHint": "floor",
  "label": "Cushion stack",
  "viewBox": {"w": 128, "h": 112},
  "anchor": {"x": 0.5, "y": 1},
  "palette": ["#F4B79B", "#A8C6A0", "#F7D98B"],
  "shapes": [
    {"t": "path", "fill": 0, "stroke": true, "d": "M113.08 88C113.32 91.59 112.74 96.51 108.6 98.96C104.47 101.41 99.67 102.12 88.27 102.7C76.87 103.28 51.47 103.09 40.19 102.42C28.91 101.75 24.8 101.07 20.6 98.66C16.4 96.26 15 91.56 15 88C14.99 84.44 16.42 79.76 20.58 77.33C24.73 74.9 28.75 74.02 39.92 73.42C51.09 72.81 76.4 73.04 87.61 73.7C98.82 74.36 102.94 75.01 107.18 77.39C111.43 79.77 112.84 84.41 113.08 88Z"},
    {"t": "rect", "fill": 2, "stroke": false, "x": 58, "y": 76, "w": 12, "h": 22, "rx": 5},
    {"t": "path", "fill": 1, "stroke": true, "d": "M103.51 62C103.59 65.36 102.75 69.91 99.13 72.14C95.52 74.36 91.39 74.75 81.82 75.34C72.25 75.92 51.27 76.17 41.72 75.65C32.17 75.13 28.15 74.5 24.53 72.23C20.92 69.95 19.91 65.38 20.03 62C20.14 58.62 21.65 54.26 25.22 51.96C28.8 49.66 32.03 48.75 41.47 48.19C50.92 47.63 72.39 47.96 81.92 48.6C91.44 49.23 95.03 49.77 98.63 52C102.22 54.24 103.42 58.64 103.51 62Z"},
    {"t": "path", "fill": 2, "stroke": true, "d": "M100.56 38C100.43 41.08 99.05 45.02 96.26 47.12C93.47 49.22 91.15 50.02 83.82 50.58C76.49 51.14 59.78 51.03 52.28 50.5C44.79 49.97 41.73 49.48 38.87 47.4C36.01 45.32 35.09 41.12 35.12 38C35.16 34.88 36.29 30.8 39.09 28.67C41.89 26.54 44.53 25.75 51.95 25.23C59.37 24.72 76.11 25.01 83.62 25.58C91.13 26.15 94.17 26.58 96.99 28.65C99.82 30.72 100.68 34.92 100.56 38Z"}
  ]
}
