{
  "schemaVersion": 1,
  "format": "aroomi-shape-v1",
  "kind": "background_piece",
  "layerHint": "floor",
  "label": "Round rug",
  "viewBox": {"w": 192, "h": 112},
  "anchor": {"x": 0.5, "y": 0.5},
  "palette": ["#D98B63", "#FFF4DF", "#F4B79B"],
  "shapes": [
    {"t": "path", "fill": 0, "stroke": true, "d": "M181.86 56C182.14 65.79 176.21 77.74 166.36 85.72C156.5 93.69 138.93 100.82 122.74 103.85C106.55 106.88 85.13 107.05 69.23 103.91C53.33 100.77 37.09 92.99 27.34 85C17.59 77.02 10.87 65.73 10.72 56C10.57 46.27 16.61 34.49 26.42 26.61C36.22 18.72 53.53 11.71 69.56 8.69C85.59 5.66 106.73 5.38 122.58 8.43C138.44 11.48 154.82 19.05 164.7 26.98C174.58 34.91 181.59 46.21 181.86 56Z"},
    {"t": "ellipse", "fill": 1, "stroke": false, "cx": 165.58, "cy": 63.95, "rx": 4.5, "ry": 4.2},
    {"t": "ellipse", "fill": 1, "stroke": false, "cx": 144, "cy": 85.47, "rx": 4.5, "ry": 4.2},
    {"t": "ellipse", "fill": 1, "stroke": false, "cx": 104.09, "cy": 95.74, "rx": 4.5, "ry": 4.2},
    {"t": "ellipse", "fill": 1, "stroke": false, "cx": 61.08, "cy": 90.83, "rx": 4.5, "ry": 4.2},
    {"t": "ellipse", "fill": 1, "stroke": false, "cx": 31.41, "cy": 72.61, "rx": 4.5, "ry": 4.2},
    {"t": "ellipse", "fill": 1, "stroke": false, "cx": 26.42, "cy": 48.05, "rx": 4.5, "ry": 4.2},
    {"t": "ellipse", "fill": 1, "stroke": false, "cx": 48, "cy": 26.53, "rx": 4.5, "ry": 4.2},
    {"t": "ellipse", "fill": 1, "stroke": false, "cx": 87.91, "cy": 16.26, "rx": 4.5, "ry": 4.2},
    {"t": "ellipse", "fill": 1, "stroke": false, "cx": 130.92, "cy": 21.17, "rx": 4.5, "ry": 4.2},
    {"t": "ellipse", "fill": 1, "stroke": false, "cx": 160.59, "cy": 39.39, "rx": 4.5, "ry": 4.2},
    {"t": "path", "fill": 1, "stroke": true, "d": "M152.21 56C152.28 62.4 147.6 70.11 141.1 75.31C134.59 80.5 123.54 85.27 113.2 87.19C102.85 89.1 89.47 88.76 79.01 86.82C68.55 84.87 56.91 80.64 50.43 75.51C43.95 70.37 40.02 62.46 40.13 56C40.23 49.54 44.59 41.9 51.06 36.76C57.54 31.62 68.65 27.1 78.99 25.14C89.32 23.19 102.8 23.08 113.07 25.04C123.35 26.99 134.13 31.72 140.65 36.88C147.17 42.04 152.13 49.6 152.21 56Z"},
    {"t": "path", "fill": 2, "stroke": true, "d": "M125.7 56C125.86 60 122.61 65.51 117.66 68.27C112.71 71.04 103.22 72.58 96 72.58C88.78 72.58 79.33 71.03 74.36 68.26C69.38 65.5 66.11 60.07 66.15 56C66.18 51.93 69.57 46.63 74.55 43.85C79.53 41.06 88.97 39.2 96 39.27C103.03 39.34 111.77 41.47 116.72 44.26C121.67 47.05 125.54 52 125.7 56Z"}
  ]
}
