{
  "schemaVersion": 1,
  "format": "aroomi-shape-v1",
  "kind": "prop",
  "layerHint": "wall",
  "label": "Star mobile",
  "viewBox": {"w": 128, "h": 160},
  "anchor": {"x": 0.5, "y": 0},
  "palette": ["#C99A6B", "#F7D98B", "#AACBE2"],
  "shapes": [
    {"t": "path", "fill": null, "stroke": true, "d": "M30 18L30 62"},
    {"t": "path", "fill": null, "stroke": true, "d": "M64 18L64 96"},
    {"t": "path", "fill": null, "stroke": true, "d": "M98 18L98 70"},
    {"t": "rect", "fill": 0, "stroke": true, "x": 14, "y": 6, "w": 100, "h": 12, "rx": 6},
    {"t": "path", "fill": 1, "stroke": true, "d": "M30 59.59C32.04 59.58 33.29 67.42 36.13 69.57C38.96 71.71 46.39 70.52 47.03 72.47C47.67 74.41 41.05 77.9 39.97 81.24C38.88 84.57 42.18 91.28 40.52 92.48C38.86 93.69 33.49 88.5 30 88.48C26.51 88.46 21.27 93.55 19.57 92.35C17.88 91.15 20.93 84.61 19.85 81.3C18.76 77.99 12.39 74.44 13.07 72.5C13.75 70.55 21.09 71.77 23.91 69.62C26.73 67.47 27.96 59.6 30 59.59Z"},
    {"t": "path", "fill": 2, "stroke": true, "d": "M64 93.5C66.27 93.45 67.75 102.09 70.92 104.47C74.1 106.86 82.33 105.62 83.04 107.81C83.75 110.01 76.42 113.95 75.18 117.63C73.93 121.32 77.43 128.54 75.57 129.93C73.71 131.31 67.84 125.95 64 125.93C60.16 125.91 54.36 131.18 52.53 129.79C50.7 128.4 54.37 121.26 53.02 117.57C51.67 113.88 43.71 109.77 44.42 107.64C45.13 105.5 54.01 107.1 57.28 104.75C60.54 102.39 61.73 93.54 64 93.5Z"},
    {"t": "path", "fill": 1, "stroke": true, "d": "M98 68.37C100.03 68.33 101.39 75.45 104.2 77.47C107 79.5 114.24 78.57 114.85 80.52C115.47 82.48 108.92 85.87 107.87 89.21C106.83 92.55 110.23 99.4 108.58 100.56C106.94 101.73 101.58 96.14 98 96.21C94.42 96.27 88.81 102.12 87.13 100.96C85.45 99.81 88.86 92.68 87.9 89.28C86.94 85.89 80.67 82.51 81.35 80.59C82.03 78.66 89.22 79.77 91.99 77.73C94.77 75.7 95.97 68.42 98 68.37Z"}
  ]
}
