{
  "schemaVersion": 1,
  "format": "aroomi-shape-v1",
  "kind": "background_piece",
  "layerHint": "floor",
  "label": "DONT no outline",
  "viewBox": {"w": 192, "h": 112},
  "anchor": {"x": 0.5, "y": 0.5},
  "palette": ["#D98B63", "#FFF4DF", "#F4B79B"],
  "shapes": [
    {"t": "path", "fill": 0, "stroke": false, "d": "M181.22 56C181.3 65.87 176.13 77.86 166.31 85.7C156.49 93.54 138.48 99.99 122.29 103.04C106.1 106.09 85.22 106.92 69.17 104.01C53.11 101.1 35.9 93.59 25.96 85.59C16.01 77.58 9.35 65.79 9.51 56C9.67 46.21 16.99 34.85 26.92 26.82C36.85 18.79 53.2 10.82 69.09 7.85C84.98 4.87 106.15 5.87 122.28 8.97C138.41 12.08 156.03 18.66 165.85 26.49C175.68 34.33 181.15 46.13 181.22 56Z"},
    {"t": "path", "fill": 1, "stroke": false, "d": "M152.44 56C152.35 62.53 148.01 70.28 141.46 75.46C134.92 80.65 123.67 85.03 113.16 87.11C102.64 89.19 88.74 89.91 78.39 87.93C68.05 85.95 57.57 80.55 51.08 75.23C44.6 69.91 39.59 62.46 39.48 56C39.38 49.54 43.89 41.7 50.44 36.49C56.99 31.29 68.31 26.77 78.79 24.78C89.27 22.8 102.79 22.65 113.33 24.57C123.87 26.49 135.51 31.06 142.03 36.29C148.54 41.53 152.54 49.47 152.44 56Z"},
    {"t": "path", "fill": 2, "stroke": false, "d": "M126.66 56C126.57 60.05 122.27 65.09 117.16 67.99C112.05 70.89 103 73.41 96 73.38C89 73.35 80.23 70.69 75.18 67.8C70.13 64.9 65.71 59.95 65.68 56C65.65 52.05 69.95 46.86 75 44.1C80.05 41.34 88.88 39.53 96 39.46C103.12 39.4 112.58 40.95 117.69 43.71C122.8 46.46 126.75 51.95 126.66 56Z"}
  ]
}
