{
  "schemaVersion": 1,
  "format": "aroomi-shape-v1",
  "kind": "background_piece",
  "layerHint": "wall",
  "label": "Dot garland",
  "viewBox": {"w": 192, "h": 80},
  "anchor": {"x": 0.5, "y": 0},
  "palette": ["#F4B79B", "#F7D98B", "#A8C6A0"],
  "shapes": [
    {"t": "path", "fill": null, "stroke": true, "d": "M10 12Q96 62 182 12"},
    {"t": "ellipse", "fill": 0, "stroke": true, "cx": 29.93, "cy": 35.57, "rx": 10.72, "ry": 12.73},
    {"t": "ellipse", "fill": 1, "stroke": true, "cx": 63.5, "cy": 48.12, "rx": 10.55, "ry": 12},
    {"t": "ellipse", "fill": 2, "stroke": true, "cx": 96.1, "cy": 50.54, "rx": 10.5, "ry": 12.02},
    {"t": "ellipse", "fill": 0, "stroke": true, "cx": 129.61, "cy": 47.58, "rx": 10.85, "ry": 12.86},
    {"t": "ellipse", "fill": 1, "stroke": true, "cx": 162.32, "cy": 36.31, "rx": 11.15, "ry": 12.92}
  ]
}
