{
  "schemaVersion": 1,
  "format": "aroomi-shape-v1",
  "kind": "prop",
  "layerHint": "floor",
  "label": "Round side table",
  "viewBox": {"w": 96, "h": 128},
  "anchor": {"x": 0.5, "y": 1},
  "palette": ["#C99A6B", "#D98B63", "#FFF4DF"],
  "shapes": [
    {"t": "path", "fill": 1, "stroke": true, "d": "M77.82 116C77.8 117.89 74.15 120.3 69.18 121.65C64.21 122.99 55.11 124.05 48 124.06C40.89 124.07 31.58 123.07 26.53 121.73C21.48 120.38 17.72 117.91 17.71 116C17.69 114.09 21.38 111.58 26.43 110.25C31.48 108.92 40.85 108 48 108.01C55.15 108.02 64.33 108.99 69.3 110.32C74.27 111.65 77.84 114.11 77.82 116Z"},
    {"t": "rect", "fill": 1, "stroke": true, "x": 42, "y": 52, "w": 12, "h": 62, "rx": 4},
    {"t": "path", "fill": 0, "stroke": true, "d": "M89.44 46C89.48 48.76 87.04 52.08 82.3 54.31C77.56 56.53 68.89 58.5 61 59.34C53.12 60.18 42.9 60.18 34.99 59.34C27.08 58.51 18.44 56.57 13.55 54.34C8.67 52.12 5.58 48.75 5.7 46C5.82 43.25 9.37 40.04 14.27 37.83C19.18 35.63 27.3 33.66 35.11 32.78C42.92 31.89 53.31 31.69 61.14 32.52C68.96 33.35 77.34 35.5 82.06 37.75C86.78 40 89.4 43.24 89.44 46Z"},
    {"t": "ellipse", "fill": 2, "stroke": false, "cx": 48, "cy": 44, "rx": 24, "ry": 6}
  ]
}
