{
  "schemaVersion": 1,
  "format": "aroomi-shape-v1",
  "kind": "bubble_frame",
  "label": "Scallop bubble",
  "viewBox": {"w": 128, "h": 96},
  "anchor": {"x": 0.78, "y": 0.94},
  "palette": ["#F7D98B", "#F4B79B"],
  "shapes": [
    {"t": "path", "fill": 1, "stroke": true, "d": "M80 68Q90 86 106 93Q96 82 100 66Z"},
    {"t": "path", "fill": 0, "stroke": true, "d": "M9.76 28.3Q9.23 17.94 18.84 14Q26.61 7.19 35.58 12.32Q44.13 5.97 53.16 11.61Q62.32 5.89 71.11 12.17Q79.67 5.87 88.65 11.56Q97.83 6.22 106.14 12.84Q116.08 14.57 117.34 24.58Q123.65 33.43 117.96 42.7Q123.97 51.22 117.99 59.77Q118.78 70.18 109.26 74.45Q101.16 81.33 91.8 76.27Q83.22 82.15 74.83 76.02Q65.83 82.24 56.55 76.46Q47.56 82.21 38.93 75.96Q30.17 81.61 21.88 75.28Q11.67 73.17 10.21 62.85Q4.2 54.16 10.19 45.46Q3.98 37.03 9.76 28.3Z"},
    {"t": "rect", "fill": 0, "stroke": false, "x": 22, "y": 22, "w": 84, "h": 44, "rx": 8}
  ],
  "textArea": {"x": 32, "y": 30, "w": 64, "h": 28},
  "textFill": 0,
  "tail": {"x": 106, "y": 93}
}
