{
  "schemaVersion": 1,
  "format": "aroomi-shape-v1",
  "kind": "bubble_frame",
  "label": "Cloud bubble",
  "viewBox": {"w": 128, "h": 96},
  "anchor": {"x": 0.1, "y": 0.94},
  "palette": ["#E6F0F7", "#AACBE2"],
  "shapes": [
    {"t": "path", "fill": 0, "stroke": true, "d": "M116.35 42Q120.08 53.28 109.2 58.06Q103.7 70.71 89.95 69.66Q78.27 79.68 64 73.92Q49.73 79.67 38.07 69.64Q24.42 70.56 19.25 57.9Q8.34 53.28 11.98 42Q8.23 30.77 19.09 26.04Q24.46 13.41 38.15 14.44Q49.76 4.4 64 10.14Q78.23 4.43 89.8 14.5Q103.62 13.25 109.44 25.86Q120.25 30.78 116.35 42Z"},
    {"t": "ellipse", "fill": 0, "stroke": false, "cx": 64, "cy": 42, "rx": 44, "ry": 26.5},
    {"t": "ellipse", "fill": 1, "stroke": true, "cx": 24, "cy": 82, "rx": 8, "ry": 6.5},
    {"t": "ellipse", "fill": 1, "stroke": true, "cx": 12, "cy": 90, "rx": 5, "ry": 4}
  ],
  "textArea": {"x": 37, "y": 29, "w": 54, "h": 26},
  "textFill": 0,
  "tail": {"x": 12, "y": 90}
}
