{
  "schemaVersion": 1,
  "format": "aroomi-shape-v1",
  "kind": "background_piece",
  "layerHint": "wall",
  "label": "Dots patch",
  "viewBox": {"w": 128, "h": 128},
  "anchor": {"x": 0.5, "y": 0.5},
  "palette": ["#FFF4DF", "#F4B79B"],
  "shapes": [
    {"t": "rect", "fill": 0, "stroke": true, "x": 8, "y": 8, "w": 112, "h": 112, "rx": 14},
    {"t": "ellipse", "fill": 1, "stroke": false, "cx": 64, "cy": 64, "rx": 20, "ry": 20}
  ]
}
