{
  "schemaVersion": 1,
  "format": "aroomi-shape-v1",
  "kind": "background_piece",
  "layerHint": "wall",
  "label": "DONT clutter grid",
  "viewBox": {"w": 128, "h": 128},
  "anchor": {"x": 0.5, "y": 0.5},
  "palette": ["#AACBE2", "#F7D98B", "#A8C6A0"],
  "shapes": [
    {"t": "rect", "fill": 0, "stroke": true, "x": 8, "y": 8, "w": 112, "h": 112},
    {"t": "rect", "fill": 1, "stroke": false, "x": 14, "y": 14, "w": 12, "h": 12},
    {"t": "rect", "fill": 2, "stroke": false, "x": 14, "y": 31, "w": 12, "h": 12},
    {"t": "rect", "fill": 1, "stroke": false, "x": 14, "y": 48, "w": 12, "h": 12},
    {"t": "rect", "fill": 2, "stroke": false, "x": 14, "y": 65, "w": 12, "h": 12},
    {"t": "rect", "fill": 1, "stroke": false, "x": 14, "y": 82, "w": 12, "h": 12},
    {"t": "rect", "fill": 2, "stroke": false, "x": 14, "y": 99, "w": 12, "h": 12},
    {"t": "rect", "fill": 2, "stroke": false, "x": 31, "y": 14, "w": 12, "h": 12},
    {"t": "rect", "fill": 1, "stroke": false, "x": 31, "y": 31, "w": 12, "h": 12},
    {"t": "rect", "fill": 2, "stroke": false, "x": 31, "y": 48, "w": 12, "h": 12},
    {"t": "rect", "fill": 1, "stroke": false, "x": 31, "y": 65, "w": 12, "h": 12},
    {"t": "rect", "fill": 2, "stroke": false, "x": 31, "y": 82, "w": 12, "h": 12},
    {"t": "rect", "fill": 1, "stroke": false, "x": 31, "y": 99, "w": 12, "h": 12},
    {"t": "rect", "fill": 1, "stroke": false, "x": 48, "y": 14, "w": 12, "h": 12},
    {"t": "rect", "fill": 2, "stroke": false, "x": 48, "y": 31, "w": 12, "h": 12},
    {"t": "rect", "fill": 1, "stroke": false, "x": 48, "y": 48, "w": 12, "h": 12},
    {"t": "rect", "fill": 2, "stroke": false, "x": 48, "y": 65, "w": 12, "h": 12},
    {"t": "rect", "fill": 1, "stroke": false, "x": 48, "y": 82, "w": 12, "h": 12},
    {"t": "rect", "fill": 2, "stroke": false, "x": 48, "y": 99, "w": 12, "h": 12},
    {"t": "rect", "fill": 2, "stroke": false, "x": 65, "y": 14, "w": 12, "h": 12},
    {"t": "rect", "fill": 1, "stroke": false, "x": 65, "y": 31, "w": 12, "h": 12},
    {"t": "rect", "fill": 2, "stroke": false, "x": 65, "y": 48, "w": 12, "h": 12},
    {"t": "rect", "fill": 1, "stroke": false, "x": 65, "y": 65, "w": 12, "h": 12},
    {"t": "rect", "fill": 2, "stroke": false, "x": 65, "y": 82, "w": 12, "h": 12},
    {"t": "rect", "fill": 1, "stroke": false, "x": 65, "y": 99, "w": 12, "h": 12},
    {"t": "rect", "fill": 1, "stroke": false, "x": 82, "y": 14, "w": 12, "h": 12},
    {"t": "rect", "fill": 2, "stroke": false, "x": 82, "y": 31, "w": 12, "h": 12},
    {"t": "rect", "fill": 1, "stroke": false, "x": 82, "y": 48, "w": 12, "h": 12},
    {"t": "rect", "fill": 2, "stroke": false, "x": 82, "y": 65, "w": 12, "h": 12},
    {"t": "rect", "fill": 1, "stroke": false, "x": 82, "y": 82, "w": 12, "h": 12},
    {"t": "rect", "fill": 2, "stroke": false, "x": 82, "y": 99, "w": 12, "h": 12},
    {"t": "rect", "fill": 2, "stroke": false, "x": 99, "y": 14, "w": 12, "h": 12},
    {"t": "rect", "fill": 1, "stroke": false, "x": 99, "y": 31, "w": 12, "h": 12},
    {"t": "rect", "fill": 2, "stroke": false, "x": 99, "y": 48, "w": 12, "h": 12},
    {"t": "rect", "fill": 1, "stroke": false, "x": 99, "y": 65, "w": 12, "h": 12},
    {"t": "rect", "fill": 2, "stroke": false, "x": 99, "y": 82, "w": 12, "h": 12},
    {"t": "rect", "fill": 1, "stroke": false, "x": 99, "y": 99, "w": 12, "h": 12}
  ]
}
